{
  "name": "Leia Organa",
  "title": "Fearless and Inventive",
  "faction": "Rebel Alliance",
  "rank": "Commander",
  "unit_type": "Trooper",
  "stats": {
    "health": 6,
    "courage": 2,
    "speed": 2,
    "defense_die": "White",
    "surges": {
      "attack": "Critical",
      "defense": "Block"
    }
  },
  "keywords": [
    {
      "ref": "keywords/take_cover",
      "value": 2
    },
    {
      "ref": "keywords/exemplar"
    },
    {
      "ref": "keywords/inspire",
      "value": 2
    },
    {
      "ref": "keywords/nimble"
    },
    {
      "ref": "keywords/sharpshooter",
      "value": 2
    }
  ],
  "weapons": [
    {
      "name": "Martial Arts",
      "range": "melee",
      "dice": {
        "black": 3,
        "red": 0,
        "white": 0
      },
      "keywords": []
    },
    {
      "name": "Leia's Blaster",
      "range": [
        1,
        2,
        3
      ],
      "dice": {
        "black": 3,
        "red": 0,
        "white": 0
      },
      "keywords": []
    }
  ],
  "upgrade_slots": {
    "Command": 2,
    "Training": 1,
    "Gear": 1
  }
}
