{
  "name": "Luke Skywalker",
  "title": "Hero of the Rebellion",
  "faction": "Rebel Alliance",
  "rank": "Commander",
  "unit_type": "Trooper",
  "stats": {
    "health": 6,
    "courage": 3,
    "speed": 2,
    "defense_die": "Red",
    "surges": {
      "attack": "Critical",
      "defense": "None"
    }
  },
  "keywords": [
    {
      "ref": "keywords/jump",
      "value": 1
    },
    {
      "ref": "keywords/block"
    },
    {
      "ref": "keywords/charge"
    },
    {
      "ref": "keywords/immune",
      "value": "Pierce"
    },
    {
      "ref": "keywords/inspire",
      "value": 2
    },
    {
      "ref": "keywords/sharpshooter",
      "value": 1
    }
  ],
  "weapons": [
    {
      "name": "Anakin's Lightsaber",
      "range": "melee",
      "dice": {
        "red": 2,
        "black": 3,
        "white": 0
      },
      "keywords": [
        {
          "ref": "keywords/impact",
          "value": 2
        },
        {
          "ref": "keywords/pierce",
          "value": 1
        }
      ]
    },
    {
      "name": "Luke's Blaster",
      "range": [
        1,
        2
      ],
      "dice": {
        "red": 1,
        "black": 3,
        "white": 0
      },
      "keywords": [
        {
          "ref": "keywords/long_shot"
        },
        {
          "ref": "keywords/pierce",
          "value": 1
        }
      ]
    }
  ],
  "upgrade_slots": {
    "Force": 1,
    "Command": 1,
    "Training": 1,
    "Gear": 1
  }
}
