{
  "name": "Luke Skywalker",
  "title": "Jedi Knight",
  "faction": "Rebel Alliance",
  "rank": "Operative",
  "unit_type": "Trooper",
  "stats": {
    "health": 7,
    "courage": 4,
    "speed": 2,
    "defense_die": "Red",
    "surges": {
      "attack": "Critical",
      "defense": "None"
    }
  },
  "keywords": [
    {
      "ref": "keywords/jump",
      "value": 1
    },
    {
      "ref": "keywords/charge"
    },
    {
      "ref": "keywords/deflect"
    },
    {
      "ref": "keywords/disengage"
    },
    {
      "ref": "keywords/immune",
      "value": "Pierce"
    },
    {
      "ref": "keywords/master_of_the_force",
      "value": 1
    }
  ],
  "weapons": [
    {
      "name": "Luke's Lightsaber",
      "range": "melee",
      "dice": {
        "black": 7,
        "red": 0,
        "white": 0
      },
      "keywords": [
        {
          "ref": "keywords/impact",
          "value": 2
        },
        {
          "ref": "keywords/pierce",
          "value": 2
        }
      ]
    }
  ],
  "upgrade_slots": {
    "Force": 3,
    "Training": 1
  }
}
